title,company,location,salary,description,experience,employment_type,schedule,working_hours,work_format,published_date,link,skills,salary_range,published_date_dt
Бизнес-аналитик,ТОО ОЭлИкс Групп (OLX Group),Не указано,Не указано,"ДОБРО ПОЖАЛОВАТЬ В OLX
322 млн активных пользователей в месяц; Выручка в размере 1,6 млрд долларов США и рост выручки на 18% (в 2021 финансовом году; рост на 36% в 2020 финансовом году);
Часть Prosus Naspers, одного из крупнейших технологических инвесторов в мире (ранний инвестор Tencent и владелец StackOverFlow).
+30 стран. +20 брендов. Работает более 10 000 сотрудников, представляющих 81 национальность.
Международная компания OLX Group ищет в свою дружную команду Бизнес-аналитика

Обязанности:

Анализ базы данных пользователей
Анализ подходов к ценообразованию, планированию продаж, доходов компании, оттока пользователей
Анализ эффективности проведения маркетинговых активностей
Предоставление рекомендаций по улучшению продаж, уменьшению оттока, удержанию пользователей
Ведение регулярных аналитических отчетов и их оптимизация
Расчет бизнес-кейсов при внедрении новых услуг, тарифных пакетов
Анализ основных тенденций e-commerce рынка
Построение, поддержка, постоянное усовершенствование моделей планирования доходов (продаж) и расходов;
Создание, поддержка и актуализация аналитических баз данных
Подготовка отчетности
Веб-аналитика и другие измерения влияния изменений в системе по соответствующим КПЭ
Аналитическая поддержка, координация и работа с различными базами данных, их интерпретация
Оптимизация сегментации, структуры отчета, обеспечение непрерывного совершенствования бизнес-процессов

Требования:

Высшее образование (экономика, финансы, маркетинг, IT, математика)
Опыт работы в сфере бизнес аналитики от 3-х лет, включая опыт работы с аналитикой продаж
Наличие опыта работы в сфере электронной коммерции, интернет проектах будет преимуществом
Опыт в монетизации желателен
Навыки анализа и оценки коммерческих показателей деятельности компании; создание моделей
Опыт работы с базами данных и цифрами, способность замечать и понимать закономерности корреляции и причинной связи между различными коммерческими показателями и событиями
Отличные коммуникативные навыки (устные и письменные)
Письменный английский язык на уровне не ниже Upper-Intermediate
MS Excel на уровне продвинутого пользователя, способность работать с большими объемами данных, создавать и использовать макросы, сводные таблицы
Продвинутый пользователь MS PowerPoint
Продвинутый пользователь SQL (Postgre, MySQL, MS SQL)
Глубокое понимание/знание Google Analytics и инструментов для отслеживания пользователей будет плюсом
Знание анализа бизнес-процессов и их оптимизации
Системность, логическое мышление, настойчивость в достижении целей
Высокие аналитические способности
Командный игрок, умение определять приоритеты
Высокая самоорганизация и личная результативность
Интерес к новому и высокая любознательность
Инициативность
Позитивный настрой и отношение к жизни
Высокая адаптивность

Условия:

Работа в компании, входящей в международную группу Naspers
Постоянное обучение и возможности для развития; рост мастерства на ежедневной основе
Официальное трудоустройство согласно законодательству РК
Конкурентоспособная оплата труда
Медицинская страховка после успешного завершения испытательного срока
Возможность компенсации спорта и языковых курсов согласно политике компании после успешного прохождения испытательного срока
Западная культура работы и ведения бизнеса, работа в команде профессионалов
Молодая и активная команда - мы любим посмеяться, но работу воспринимаем всерьез
Яркие и запоминающиеся корпоративные мероприятия

Мы стремимся создать комфортные условия каждому члену нашей команды и заинтересованы в долгосрочном сотрудничестве с достойными кандидатами.

Присоединяйся к единомышленникам - большой и дружной команде OLX!",3–6 лет,Полная занятость,График: 5/2,8,Не указано,29 апреля 2025,https://hh.kz/vacancy/120050347?query=BI+Analyst&hhtmFrom=vacancy_search_list,Не указано,Не указано,2025-04-29
Senior Process engineer designer,ТОО Bolashak Atyrau,Не указано,Не указано,"Requirements:

Technical management of development of complex project units

Verification and coordination of documentation

Participation in collection of initial data for design

Control of work performance by executors

Making adjustments in project documentation

Increase of labor productivity and quality of documentation

Ability to work in Aspen HYSYS:

Creation and verification of process schemes

Modeling of gas treatment plants

Calculation of heat exchange equipment

Optimization of process regimes

Sensitivity analysis of processes

Preparation of report documentation

Atyrau 5/2",3–6 лет,Полная занятость,График: 5/2,Не указано,Не указано,29 апреля 2025,https://hh.kz/vacancy/120056410?query=Data+Engineer&hhtmFrom=vacancy_search_list,Не указано,Не указано,2025-04-29
