title,company,location,salary,description,experience,employment_type,schedule,working_hours,work_format,link,published_date,skills
MLOps AWS/Data Scientist,ООО Шарп Девелоперс,Не указано,Не указано,"Удаленно, рабочий часовой пояс GMT+4. Нужен хороший устный английский не ниже B2!!!!

О нас:

SHARP DEVELOPERS – разработчик программного обеспечения для мобильных устройств и веб-сайтов для заказчиков из США, Европы и России.

Наши клиенты — компании-разработчики продуктов в различных сферах: финтех, путешествия, спорт, медицина, развлечения, медиа, промышленность. Мы работаем над более чем 30 проектами — выберите для себя интересный!

- Мы распределённая команда и у нас обширная география: кто-то работает в Турции, кто-то в Армении, Грузии, Казахстане, Таджикистане, Беларуси, странах ЕС, с Маврикия, кто-то разбросан по России - все мы встречаемся в общих Slack-чатах, где на русском языке обсуждаем и празднуем вместе важные события онлайн и делимся экспертизой, не вставая с дивана. Офиса нет - он прямо у вас дома, это 100% удалёнка в самом чистом ее виде.

На самих проектах общение (дейли и тд.) полностью на английском - поэтому мы ищем того, кто владеет английским языком на уровне не ниже B2.

В роли Data Scientist вы будете работать над извлечением значимой информации из больших наборов данных, разработкой моделей машинного обучения и созданием векторных баз знаний для улучшения бизнес-процессов и продуктов для наших зарубежных заказчиков (проекта под NDA).

Responsibilities:
To identify three ML models
To prepare data for three ML models
To test the models with the provided data (three iterations)
To prepare a report with ML model results (accuracy, recall, confidence)
To prepare instructions for the models' deployment in the form of PoC

Требования:

Hard:
Machine Learning & AI – Model selection, training, and optimization
Data Preparation & Preprocessing – Cleaning, feature engineering, handling missing values
Model Evaluation & Performance Metrics – Accuracy, recall, confidence, precision, F1-score
Statistical Analysis & Mathematics – Probability, linear algebra, hypothesis testing
ML Model Deployment – Writing PoC documentation, using AWS

Soft:
Problem-Solving – Ability to analyze complex datasets and derive insights
Analytical Thinking – Strong logical and critical thinking skills
Attention to Detail – Ensuring data quality and model accuracy
Communication Skills – Ability to present ML results to both technical and non-technical stakeholders
Collaboration & Teamwork – Working effectively with Architect, Engineers, Analysts, and Business teams
Time Management – Balancing multiple ML iterations and deadlines efficiently
Documentation & Reporting – Writing clear model evaluation reports and PoC deployment guides
Creativity & Innovation – Thinking outside the box for model improvements

Что мы предлагаем:

работа удаленного формата с понедельника по пятницу с гибким началом дня
предоставляется отпуск, оплачиваются больничные

постоянную рабочую практику английского языка в российско-американской команде

телемедицина для Вас и семьи

обучение по технологиям в оплачиваемое рабочее время

погружение в культуру западных компаний, стандарты работы за рубежом.

P.S. При отклике в сопроводительном письме укажите, пожалуйста, информацию:

Ваш username telegram
Локацию пребывания
Ваши зарплатные ожидания

Спасибо!",более 6 лет,Полная занятость,График: 5/2,Рабочие часы: 8,Формат работы: удалённо,https://almaty.hh.kz/vacancy/119483897?query=ML+Engineer&hhtmFrom=vacancy_search_list,14 апреля 2025,"Английский язык,MLflow,Statistical Analysis System,Mathematical Modeling,Amazon Web Services,Английский — B2 — Средне-продвинутый,Русский — B2 — Средне-продвинутый"
Data Scientist,Публичная Компания «Freedom Finance Global PLC»,Не указано,Не указано,"Данная вакансия открыта для Freedom Holding Operations - дочерняя компания Freedom Holding Corp (далее - «Холдинг»).

Образование и опыт:

Высшее образование (бакалавр или выше) в области математики, статистики, компьютерных наук, инженерии или смежных дисциплин.

Обязанности:

Проведение анализа клиентской базы, построение моделей машинного обучения (ML), включая:
Сегментацию клиентов;
Прогнозирование склонности к покупке/оттоку;
Оценку жизненной ценности клиента (LTV).
Разработка и усовершенствование рекомендательных систем.
Проведение глубокого анализа данных и выявление ключевых инсайтов для поддержки принятия управленческих решений.
Взаимодействие с бизнес-заказчиками для формирования подходов к решению задач с использованием инструментов ML, включая полную разработку ML-сервисов (end-to-end).
Построение предиктивных моделей и внедрение их в производственные среды.
Мониторинг эффективности моделей, их дообучение и корректировка.

Технические навыки:

Отличное владение Python.
Опыт работы с библиотеками для анализа данных и машинного обучения:
NumPy, pandas, scikit-learn, TensorFlow, PyTorch.
Уверенное владение SQL для извлечения и обработки данных.
Навыки работы с большими наборами данных.
Опыт построения и оценки моделей машинного обучения (регрессия, классификация, кластеризация).
Управление жизненным циклом моделей машинного обучения (автоматизация, оптимизация, переобучение и обновление).

Навыки работы с нейросетями:

Опыт работы с PyTorch.
Знание различных архитектур нейронных сетей (например, CNN, RNN, LSTM).
Владение методами предварительной обработки данных и инженерии признаков (feature engineering).
Опыт настройки гиперпараметров и оптимизации моделей.

Аналитические и профессиональные навыки:

Знание статистических методов и умение проверять гипотезы.
Умение доступно объяснять сложные технические концепции для различных аудиторий.
Способность эффективно работать в команде и взаимодействовать с коллегами.
Навыки управления проектами и постановки задач.",1–3 года,Полная занятость,График: 5/2,Рабочие часы: 8,Формат работы: гибрид,https://almaty.hh.kz/vacancy/118976434?query=ML+Engineer&hhtmFrom=vacancy_search_list,31 марта 2025,Не указано
Senior Data Science Engineer,ТОО DIGITAL TEAM (ДИДЖИТЛ ТИМ),Не указано,Не указано,"DigitalTeam is hiring. We are a worldwide software service provider and currently looking for a Senior Data Science Engineer who can build a simulator.

Requirements:

- Bachelor’s degree in Computer Science, Engineering, or related field;

- Emphasis on Databricks and Jupyter Notebooks;

- Experience with Python, Pyspark and machine learning applications;

- Expertise in predictive modeling especially Deep Learning Models such as LSTM or Ensembles;

- Knowledge of XGBoost (Extreme Gradient Boosting);

- Ability to assess the correlation vs. causality in the predictions to ensure they make sense;

- A strong understanding of ML Ops;

- Strong problem-solving skills and attention to detail.

Responsibilities:

- Evaluate data to discover trends and patterns to improve and automate analysis;

- Migrate and import data from a variety of sources into a central database;

- Independently mine data and optimize processes;

- Apply advanced scientific knowledge to projects;

- Determine priorities for experiments;

- Utilize numerous analytical instruments.

Benefits:

- Official employment;

- Flexible work schedule;

- Professional growth and development with friendly team;

- Remote work;

- Detailed onboarding.",более 6 лет,Полная занятость,График: 5/2,Рабочие часы: 8,Формат работы: удалённо,https://almaty.hh.kz/vacancy/119587854?query=ML+Engineer&hhtmFrom=vacancy_search_list,16 апреля 2025,"Python,SQL,Английский язык,Azure,Databases"
ML Engineer,"GuardinAI, Inc",Не указано,Не указано,"We are seeking a highly motivated and skilled Machine Learning Engineer to join our team

focused on training and deploying machine learning models and fine-tuning large language

models (LLMs). This role will be central to developing efficient, scalable, and domain-specific

ML/LLM solutions that power our AI products.

Responsibilities:

• Design, implement, and optimize training pipelines for small-scale machine learning models

(e.g., decision trees, gradient boosting, small neural nets, CNN).

• Fine-tune large pre-trained language models (e.g., LLaMA, Mistral, Qwen, GPT) for specific

tasks using supervised learning, reinforcement learning (RLHF), or parameter-efficient

techniques (LoRA, QLoRA, PEFT).

• Conduct dataset preparation, preprocessing, and augmentation for both small and large

models.

• Perform hyperparameter tuning and model evaluation using appropriate metrics.

• Monitor and optimize model performance, inference speed, and memory footprint.

• Contribute to internal tools and libraries that streamline ML experimentation and deployment.

Requirements:

• Strong programming skills in Python and experience with ML frameworks like PyTorch,

HuggingFace Transformers, or scikit-learn.

• Experience in training and fine-tuning large language models using modern toolkits (e.g.,

PEFT, DeepSpeed, FSDP).

• Familiarity with distributed training, mixed-precision training, and checkpoint management.

• Solid understanding of ML fundamentals, including model selection, training/validation

workflows, and performance evaluation.

• Hands-on experience with data handling, feature engineering, and synthetic data generation.

• Working knowledge of experiment tracking tools (Weights & Biases).

• Familiarity with cloud environments (AWS, GCP, Azure) or on-premise GPU clusters.

• Strong problem-solving skills and ability to work independently in a fast-paced environment.

Nice to Have:

• Experience with retrieval-augmented generation (RAG), prompt tuning, or instruction tuning.

• Exposure to quantization and model compression techniques.• Experience with deploying ML models using APIs or serving frameworks (e.g., FastAPI, Triton

Inference Server).",1–3 года,"Полная занятость
Возможно временное оформление",График: 5/2,Рабочие часы: 7,Формат работы: гибрид,https://almaty.hh.kz/vacancy/119304454?query=ML+Engineer&hhtmFrom=vacancy_search_list,9 апреля 2025,Не указано
"Tech Lead, Управление аналитики и моделирования",АО Jusan Bank,Не указано,Не указано,"Обязанности:

Подготовка данных и переменных для моделирования, Feature Selection, Feature Engineering;
Создание ML-моделей, построение скоринговых карт;
Организация работ по разработке целевых показателей кредитного риска / моделей доходности;
Валидация / бэк тестирование / рекалибровка скоринговых моделей;
Мониторинг качества и стабильности действующих моделей;
Организация работ по имплементации моделей во внутренней инфраструктуре Банка (включая разработку стратегий внедрения, определение уровня отсечений и проведение тестирования), мониторинг результатов и основных метрик качества моделей;
Моделирование различных ситуаций для повышения УО / снижение уровня риска (проведение симуляций);
Участие в работе по контролю над кредитным риском путем анализа и мониторинга качества ссудного портфеля/поколений выдач, а также через выработку рекомендаций по улучшению структуры и качества портфеля на основе выявленных кредитных рисков и рассчитанных параметров, диверсификации кредитных рисков;
Курировать сотрудников по направлению моделирования и созданию скоринговых карт.

Требования:

высшее (специальность: экономическая, математическая, техническая);
Знание методов статистического анализа;
Сильные аналитические способности;
Понимание специфики работы с большими данными. Умение генерировать, рассчитывать и проверять гипотезы;
Опыт в построении скоринговых моделей и моделей машинного обучения;
Понимание и применение метрик качества моделей для проверки точности и устойчивости скоринговых карт;
Понимание процессов создания выборок, переменных для моделирования, определения целевой переменной;
Глубокие знания портфельного анализа и управления рисками на уровне портфелей и продуктов;
Английский на уровне свободного чтения технической документации;
Продвинутый опыт в написании SQL запросов (запросы, аналитические функции);
Знание Python, уверенное владение библиотеками pandas, scikit-learn, XGBoost, LightGBM;
Владение Apache AirFlow.

Условия:

Ежеквартальные премии;
Корпоративные предложения по фитнесу;
Корпоративные скидки на онлайн обучение в Skyeng для вас и ваших близких;
Бесплатная подписка на онлайн библитеку «Альпина Паблишер»;
Приятная рабочая атмосфера в современном офисе в деловой части города;
Возможность строить карьеру в одном из крупнейших банков Казахстана.",3–6 лет,Полная занятость,График: 5/2,Рабочие часы: 8,Формат работы: на месте работодателя,https://almaty.hh.kz/vacancy/118612376?query=ML+Engineer&hhtmFrom=vacancy_search_list,17 апреля 2025,Не указано
Data Scientist по направлению Антифрод/anti-fraud,Публичная Компания «Freedom Finance Global PLC»,Не указано,Не указано,"Образование и опыт:

Высшее образование (бакалавр или выше) в области математики, статистики, компьютерных наук, инженерии или смежных дисциплин.

Обязанности:

Проведение анализа клиентской базы, построение моделей машинного обучения (ML), включая:
Сегментацию клиентов;
Выявление аномальностей сделок, доходности, убытков.
Создание ML-моделей.
Валидация / бэк - тестирование / рекалибровка моделей.
Проведения тестирования на предмет корректного внедрения моделей.
Мониторинг качества и стабильности действующих моделей.
Внедрение моделей в production.
Взаимодействие с бизнес-заказчиком для формирования подходов к решению задач с использованием инструментов ML, включая полную разработку ML-сервисов (end-to-end).
Построение предиктивных моделей и внедрение их в производственные среды.

Технические навыки:

Отличное владение Python.
Опыт работы с библиотеками для анализа данных и машинного обучения:
NumPy, pandas, scikit-learn.
Уверенное владение SQL для извлечения и обработки данных.
Навыки работы с большими наборами данных.
Опыт построения и оценки моделей машинного обучения (регрессия, классификация, кластеризация).
Управление жизненным циклом моделей машинного обучения (автоматизация, оптимизация, переобучение и обновление).

Аналитические и профессиональные навыки:

Знание статистических методов и умение проверять гипотезы.
Способность эффективно работать в команде и взаимодействовать с коллегами.

Навыки тайм-менеджмента и сроки сдачи задач.

Условия:

Свободу в принятии решений и возможность карьерного роста в активно развивающейся международной компании.

Интересные и разнообразные задачи и проекты, которые позволяют напрямую влиять на бизнес и развитие продуктов.

Работа в дружелюбной и динамичной команде профессионалов.

Комфортабельный офис в БЦ «Есентай Тауэр».

Постоянное обучение, тренинги, возможность посещения профильных конференций и корпоративные мероприятия.

Различные бенефиты и уникальные предложения на продукты компаний Freedom Holding Corp.",3–6 лет,Полная занятость,График: 5/2,Рабочие часы: 8,Формат работы: на месте работодателя,https://almaty.hh.kz/vacancy/119147559?query=ML+Engineer&hhtmFrom=vacancy_search_list,4 апреля 2025,Не указано
Data Scientist,ТОО IBA Astana Dev (АйБиЭй Астана Дев),Не указано,Не указано,"We are looking to hire a results-driven Data Scientist with production-level ML experience and strong cloud skills to join our team.

Responsibilities:

Deliver full-cycle machine learning solutions, including exploratory data analysis (EDA), model training and tuning, feature engineering, model validation and interpretation;

Work with large-scale datasets in Databricks / Spark environments;

Deploy models to production using MLflow / MLOps pipelines;

Build dashboards and data visualizations (Power BI, Tableau);

Operate in cloud-based environments (Azure, AWS, or GCP) using storage, pipelines, orchestration tools;

Participate in client meetings, translate business problems into ML tasks, present and defend models;

Maintain and retrain models as needed.

Requirements:

5+ years of experience in Data Science / ML roles;

Deployed ML models into production, not just POCs or academic projects;

Can explain architecture and model logic to non-technical stakeholders;

Understanding of the full ML lifecycle — from raw data to dashboard;

English B2 level and higher;

Tech Stack:

Languages: Python (pandas, numpy, scikit-learn, matplotlib), SQL

Platforms: Azure, AWS, GCP, Databricks

Tools: MLflow, Spark, Synapse Analytics, Power BI, Tableau

Methods: classification, regression, clustering, time series

Processes: CI/CD, MLOps, Git, Jira, Agile/Scrum

Nice to also have:

Experience with Generative AI, NLP, LLMs

Familiarity with Spark SQL / Delta Lake

Background in consulting or multi-domain project work

Conditions:

Official employment under the Labor Code of Kazakhstan

Remote format with an option to work from the office

International projects and team",более 6 лет,Полная занятость,График: 5/2,Рабочие часы: 8,Формат работы: удалённо,https://almaty.hh.kz/vacancy/119694168?query=ML+Engineer&hhtmFrom=vacancy_search_list,18 апреля 2025,Не указано
