title,company,location,salary,description,experience,employment_type,schedule,working_hours,work_format,link,published_date,skills
Менеджер по продажам облачных решений,ТОО qCloudy,"Алматы, улица Ходжанова, 2/2","от 400 000 до 800 000 ₸ за месяц, на руки","В команду qCloudy требуется менеджер по продажам облачных решений AWS и Yandex Cloud.

qCloudy - команда сертифицированных инженеров с многолетним опытом проектирования, создания и внедрения сложных IT-решений и высоконагруженных digital проектов. Мы строим гибкие, масштабируемые, отказоустойчивые сost-effective решения в публичном облаке с применением AI/ML и поддерживаем их 24/7.

Обязанности:

Обработка запросов клиентов, заинтересованных в облачных решениях.
Консультирование клиентов по продуктам и услугам qCloudy, помощь в выборе подходящих решений.
Проведение встреч, переговоров и презентаций для клиентов.
Подготовка коммерческих предложений и контрактов.
Взаимодействие со специалистами по проектному управлениями и разработке.
Регулярная отчетность о выполнении плана продаж.
Регулярное повышение квалификации в соответствии с планом обучения.
Требования:
Опыт работы в сфере продаж от 1–3 лет в сфере IT или облачных технологий.
Знание принципов работы облачных платформ.
Умение вести переговоры и заключать сделки.
Навыки работы с CRM-системами (предпочтительно amoCRM).
Желание развиваться в области облачных технологий и изучать новые тренды.
Грамотная устная и письменная речь.
Сертификаты по специализации IT.
Условия:
Режим работы 10:00-19:00, понедельник-пятница.
Фиксированный оклад + бонусы.
Официальное трудоустройство и социальные гарантии.
Обучение и сертификация.
Доступ к передовым технологиям и работе с инновационными проектами.
Возможность карьерного роста в высокотехнологичной компании.
Дружный коллектив, позитивная обстановка.",1–3 года,Полная занятость,График: 5/2,Рабочие часы: 8,Формат работы: на месте работодателя,https://almaty.hh.kz/vacancy/118931540?query=ML+Engineer&hhtmFrom=vacancy_search_list,19 апреля 2025,"B2B Продажи,amoCRM,Поиск и привлечение клиентов,Консультирование клиентов,Заключение договоров,Подготовка коммерческих предложений,AWS,Yandex Cloud"
IT Project manager (Проектный менеджер в сфере IT),ТОО FRONT D.VISION,"Алматы, улица Желтоксан, 87","от 500 000 ₸ за месяц, на руки","IT Project manager (Проектный менеджер в сфере IT)_Middle/Junior

О компании:

FRONT D.VISION

IT компания и комплексный интегратор в сфере обработки и анализа данных. Беремся за весь цикл работы с данными. Разрабатываем программные продукты любой сложности. Включаемся во все бизнес-процессы, организовываем экосистему данных и извлекаем из них пользу вместе с вами.

ЗП: от 500к на руки

Требуемый опыт работы: от 2 лет

Полная занятость, гибкий график

ЗАДАЧИ:

Управление проектами в области построения аналитических систем, систем отчетности и ML-моделей.
Взаимодействие с заказчиками: сбор и уточнение требований, согласование сроков и результатов.
Постановка задач и контроль их выполнения для команд разработки и аналитики.
Задачи по сопровождению действующих клиентов/договоров, подготовка отчетов по форме за прошедший период.
Организация работы проектной команды, включая back-end, front-end, BI, data science, data engineering.
Разработка и поддержка проектной документации.
Организация и проведение встреч, демо и презентаций для стейкхолдеров.
Управление рисками проекта и их минимизация.
Мониторинг прогресса и соблюдения сроков, бюджетов, качества проекта.
разработка решений на базе ИИ.

ТРЕБОВАНИЯ:

Опыт работы от 2 лет в роли Project Manager в проектах DWH, Big Data, или ML.
Знание жизненного цикла разработки аналитических систем и систем отчетности.
Опыт управления проектами с использованием Waterfall и Scrum.
Понимание основ работы с ML-моделями и их внедрения в продакшн.
Навыки ведения финансовой документации по проекту (составление бюджета, P&L).
Опыт работы с системами управления проектами (Jira, Trello, MS Project).
Навыки составления презентаций и ведения технической документации.
Аналитическое мышление, умение структурировать разрозненную информацию, понимать существующие бизнес-процессы заказчиков, выдвигать гипотезы.
Не бояться сложных задач и нового опыта.

УСЛОВИЯ:

сложные и интересные задачи на динамично развивающемся рынке Big Data и аналитики данных;
многоформатность задач, реально значимый опыт в проектном менеджменте и бизнес-аналитике;
работа в молодой, приятной, амбициозной команде;
гибкий график, адекватное руководство.",1–3 года,Полная занятость,График: 5/2,Рабочие часы: 8,Формат работы: на месте работодателя или гибрид,https://almaty.hh.kz/vacancy/119147277?query=ML+Engineer&hhtmFrom=vacancy_search_list,4 апреля 2025,"Agile Project Management,Бизнес-анализ,Управление бэклогом,Project management,MS Project,Waterfall,MS PowerPoint,Scrum,Заключение договоров,Управление изменениями"
Маркетинговый аналитик,АО Kolesa (АО Колеса),"Алматы, улица Шевченко, 157Б","от 900 000 до 1 100 000 ₸ за месяц, на руки","Kolesa Group — международная IT‐компания, строим классифайды для миллионов пользователей. Наши продукты — kolesa.kz | krisha.kz | avtoelon.uz — помогают людям и бизнесам продавать и покупать авто, недвижимость, товары и услуги.

О вакансии:

В нашу команду Аналитики, которая занимается крутыми проектами: находит точки роста продуктов, строит модели монетизации, визуализирует бизнес-показатели и конверсии, находит в данных инсайты и предлагает бизнесу решения требуется маркетинговый аналитик.

Команда состоит из крутых профессионалов, собранных из разных точек мира и ставит перед собой амбициозную задачу – построить Data Driven Company. Интересные задачи и использование передового технологического стека для аналитики и маркетинга гарантируем!

И главное, мы делаем полезные для миллионов людей, присоединяйся!

Тебе предстоит:

Помогать оптимизировать наш маркетинг. Заниматься оптимизацией и повышением эффективности компаний. Строить и улучшать воронки;

Анализировать показатели сайтов и приложений для принятия продуктовых решений;

Визуализировать данные, создавать отчеты и делать выводы;

Искать инсайты в большом объеме данных для формирования маркетинговой стратегии;

Работать с командой маркетинга, data-инженерами, продуктовыми-аналитиками;

Формулировать гипотезы, запускать A/B тесты, causal inference эксперименты и подводить итоги;

Обеспечивать качество сбора данных и активно работать с DWH-инженерами;

Использовать инструментарий ML для более глубокого понимания и решения проблем в маркетинге.

Мы ждем от тебя:

Опыт работы с SQL;

Базовый Python;

Опыт с Google-Аналитика /Firebase / Яндекс-Метрика / Яндекс-App метрика или с Базовый другими системами app/web аналитики;

Понимание роли интернет-маркетинга в digtital-компаниях.

Будет преимуществом:

Опыт работы с Python;

Опыт работы с API маркетинговых инструментов (GA, AppМетрика);

Знание и опыт работы в BI системах (мы используем Microsoft Power BI);

Опыт работы со стеком Google Cloud (наша DWH построена на Google Big Query) или другими облачными хранилищами;

Знание и навыки проведения экспериментов. A/B тесты, Causal Inference методики, бутстрап и прочее;

Большим плюсом будет релевантный опыт в отделах маркетинга;

Опыт работы с ETL и системами оркестрации (предпочтительно Airflow);

Опыт работы с Я.Директ, AdWords, Facebook/Instagram, VK, MyTarget и т.п.

Что приятного предлагаем:

Работу над продуктами, которыми пользуются 12 миллионов казахстанцев;

Работу в одном из самых масштабных проектов Казнета;

Дружную и профессиональную команду, готовую в любой момент помочь и поддержать;

Социальный пакет на выбор: медицинская страховка по VIP-пакету; услуги психолога, оплата фитнеса, услуги стоматологии, обучения, авиабилетов, компенсация дет.сада, частных школ или ГСМ;

Обучение английскому и казахскому языку;

Участие в митапах, тренингах и мастер-классах, доступ к огромной библиотеке;

Офис с современной техникой, в формате оупенспейса в центре города, доступный 24/7;

Отсутствие дресс-кода и бюрократии, свобода в реализации интересных проектов;

Поддерживаем инициативу и готовы реализовывать проекты, которых в КЗ никто не делал;

Программа релокации для иногородних сотрудников.

#referral",1–3 года,Полная занятость,График: 5/2,Рабочие часы: 8,Формат работы: гибрид,https://almaty.hh.kz/vacancy/118438453?query=ML+Engineer&hhtmFrom=vacancy_search_list,15 апреля 2025,"A/B тесты,Big Data,Google API,Яндекс.Метрика,DWH,Instagram,PowerBI,Работа с большим объемом информации,Разработка стратегии продвижения продуктов,Python,SQL,Анализ поведения пользователей,Internet Marketing"
Продуктовый аналитик в Kolesa.kz,АО Kolesa (АО Колеса),Не указано,"от 900 000 до 1 100 000 ₸ за месяц, на руки","Kolesa Group — международная IT-компания, строим классифайды для 12,5 миллионов пользователей. Наши продукты — kolesa.kz | krisha.kz | avtoelon.uz — помогают людям и бизнесам продавать, покупать и владеть авто, недвижимостью, товарами и услугами.

Культура экспериментов и data driven, командный дух, технологии, постоянное развитие и желание достичь крутых результатов — отличительные черты Kolesa Team.

О вакансии:

Мы ищем Product/Data-аналитика в kolesa.kz, который будет анализировать состояние продукта и помогать совершенствовать его.

Ты будешь частью команды аналитиков (50+ специалистов), собранной из разных уголков мира. Мы работаем в тесной связке с продакт-менеджерами, исследователями и разработчиками, чтобы принимать data-driven решения и влиять на стратегию продукта.

Аналитика в Kolesa Group - ключевой драйвер роста. Если для тебя важно видеть как результаты твоей работы напрямую влияют на бизнес и помогают пользователям - тебе точно к нам!

Тебе предстоит:

Анализировать показатели приложений и сайтов для принятия продуктовых решений;

Помогать бизнесу с формированием, приоритизацией и реализацией стратегии;

Контролировать и оценивать внедрение новых продуктовых фичей с помощью экспериментов. Мы используем очень широкий инструментарий и проводим около 300 экспериментов в год;

Искать инсайты в большом объеме данных для формирования продуктовой стратегии;

Погружаться в discovery-процессы вместе с продактами, исследователями, дизайнерами и разработчиками;

Визуализировать данные, создавать отчеты и делать выводы;

Формулировать и проверять гипотезы (A/B тесты, Causal Inference эксперименты, Causal ML и т. д.);

Активно работать с DWH-инженерами и обеспечивать качество нашей data-системы;

Использовать инструментарий ML для более глубокого понимания и решения бизнес проблем и построения ML-решений;

Разрабатывать и изучать новые методики анализа данных в продукте. Мы стараемся следовать за state-of-the-art решениями в анализе данных.

Мы ждем от тебя:

Уверенное владение SQL и опыт работы с Python.

Опыт применения аналитики для решения бизнес-задач. Умение связывать бизнес и аналитический контекст в обоих направлениях;

Глубокое понимание проведения экспериментов (A/B тестирование, Causal Inference, продвинутые методы);

Опыт в продуктовой аналитике и понимание ключевых метрик.

Будет преимуществом:

Опыт работы со стеком Google Cloud (наша DWH построена на Google Big Query) или другими облачными хранилищами;

Знания и опыт работы в BI системах (мы используем Microsoft Power BI);

Опыт работы с ETL и системами оркестрации (предпочтительно Airflow);

Опыт работы с ML для решения аналитических или бизнесовых задач.

Став частью Kolesa Team, ты получишь:

Гибридный формат: офлайн в офисе в г. Алматы с возможностью работы из дома 2 раза в неделю;

Работу в сильной команде, где ценятся взаимопомощь и ориентация на результат и постоянное развитие;

Постоянный рост: система грейдирования, индивидуальные планы развития, менторство;

Тематические мероприятия: квизы, киновечера, Family Day, тимбилдинги;

Медицинскую страховку, оплату авиабилетов, фитнеса, образования и многое другое — твой выбор, куда использовать соцпакет;

Обучение: мы оплачиваем участие в конференциях, тренингах, мастер-классах;

Языковые курсы и огромная онлайн-библиотека;

Скидки на фитнес, Lamoda, Skillbox, Skyeng, Geekbrains и т.д.;

Программа релокации для иногородних сотрудников.

#referral",1–3 года,Полная занятость,График: 5/2,Рабочие часы: 8,Формат работы: на месте работодателя или гибрид,https://almaty.hh.kz/vacancy/118038202?query=ML+Engineer&hhtmFrom=vacancy_search_list,3 апреля 2025,"SQL,Python,Causal Inference,Airflow,Microsoft Power BI,A/B тесты"
