title,company,location,salary,description,experience,employment_type,schedule,working_hours,work_format,published_date,link,skills
Специалист поддержки DCS,ТОО KAZ MINERALS.MANAGMENT,Не указано,Не указано,"Обязанности:
Развивать и поддерживать отказоустойчивость промышленных систем DCS, IED.
Оперативно реагировать на аварийные ситуации в работе систем DCS, IED.
Принимать оперативные меры по восстановлению систем DSC, IED при их сбоях или выходе строя.
Выявлять неисправности и решать вопросы, связанные с обеспечением соответствующего уровня производительности промышленных систем.
Проводить тестирование и ремонт неисправного оборудования.
Выполнять работы в подключении, тестировании и модификации ПЛК/Scada перед внедрением.
Анализировать причины неполадок и неисправностей системы, вносить предложения по их устранению и профилактики, улучшать качество и надежность промышленных систем управления и электроснабжения (DCS, IED).
Поддержка, устранении неполадок ПЛК, систем DCS 800хА, MicroSCADA, сетей Profibus и Modbus, а также сети ЕС61850 и соответствующем оборудовании.
Содействовать ежедневному, еженедельному и ежемесячному планированию работ и мероприятий по электрическим и промышленным системам.
Расследовать аварий и повреждения систем.
Создавать, внедрять и тестировать планы аварийного восстановления систем DCS, IED.
Производить установку и техническое обслуживание программного обеспечения систем управления DCS, IED.
Проводить контрольные проверки работоспособности и эффективности действующих систем и технических средств мониторинга и реагирования, разрабатывать предложения по совершенствованию и повышению эффективности принимаемых мер.
Участвовать в процессе принятия решений о внедрении или модернизации компонентов DCS, IED систем.
Взаимодействовать со сторонними компаниями по вопросам, связанным с обеспечением доступа, работоспособности промышленных систем управления и электроснабжения (DCS, IED).
Подготовка и введение организационно-распорядительной документации:
Разработка политик, процедур, регламентов компании по эксплуатации, развитию/расширению систем промышленной связи.
Требования:
Опыт работы в проектировании, внедрении и/или обслуживании систем управления систем автоматизации, SCADA.
Знание принципов построения, особенностей проектирования, внедрения, эксплуатации систем DCS (distributed control system), IED (Intelligent Electronic Device).
Знание стандартов и протоколов систем DCS, IED.
Опыт ведения проектов в области DCS, практический опыт в реализации крупных проектов.
Умение составлять технические задания, технические и эксплуатационные документации.
Работа со сторонними организациями (вендорами, поставщики и др.).
Желание и возможность проявить себя в условиях поддержки существующего бизнеса и развития новых технологий.
Продвинутые знания в области АСУТП: Понимание ключевых аспектов автоматизации технологических процессов горнорудный предприятий. металлургии и специфики работы меднообогатительных комбинатов.
Экспертиза в системах ABB: Глубокие теоретические и практические знания систем ABB 800xA и MicroSCADA Pro, включая продвинутые функции, настройку, масштабирование и интеграцию с другими системами.
Опыт работы с промышленными коммуникационными протоколами, используемыми в АСУТП, такими как IEC 61850, IEC 60870-5-101/104, Modbus TCP/RTU, PROFIBUS и PROFINET.
Умение программировать и конфигурировать системы управления ABB с использованием инструментов программирования (например, Control Builder M) и знание языков программирования, таких как IEC 61131-3.
Управление электрическими сетями: Понимание принципов управления и мониторинга электрическими сетями, включая распределенные системы автоматизации подстанций (SAS) и системы управления дистрибутивной энергетикой (DMS).
Знание сетевых технологий Cisco: Глубокое понимание и практический опыт работы с линейкой промышленного оборудования Cisco, включая маршрутизаторы, коммутаторы и МСЭ, на уровне сертификации CCNP или выше. Это включает в себя, но не ограничивает, знание архитектуры промышленной сети, протоколов PTP, CIP, MODBUS TCP, IGMP, PIM, MLD, VLAN, QoS и т.д. и принципов построения высокозащищенных промышленных сетей.
Разработка и внедрение сетевых решений: Способность разрабатывать и реализовывать сетевые решения, соответствующие требованиям промышленной безопасности и надежности. Это включает создание и поддержку сетевой документации, планирование масштабируемости сети, а также анализ и устранение узких мест производительности.
Опыт формирования и оформления технических спецификаций.
Навыки по устранению неполадок в работе промышленных сетей.
Знание нормативно-правовой базы РК и международных стандартов в области АСУТП в горнорудной отрасли.
Условия:
График 5/2;
Медицинское страхование.",более 6 лет,Полная занятость,График: 5/2,Рабочие часы: 8,Не указано,28 апреля 2025,https://hh.kz/vacancy/120027302?query=Business+Intelligence+Developer&hhtmFrom=vacancy_search_list,Не указано
Payroll Specialist,ТОО Филип Моррис Казахстан,Не указано,Не указано,"Be a part of a revolutionary change

At PMI, we’ve chosen to do something incredible. We’re totally transforming our business and building our future on one clear purpose – to deliver a smoke-free future.

With huge change, comes huge opportunity. So, wherever you join us, you’ll enjoy the freedom to dream up and deliver better, brighter solutions and the space to move your career forward in endlessly different directions.

Your ‘day to day’:
• Ensure the payroll process;
• Create monthly and corrective timesheets for their further verification and approval by heads of departments;
• Monthly reconciliation of balances on the accounts of the General Ledger with payroll data;
• Take part in the preparation of salary documents for storage in the archive according to the deadlines established by the legislation of the Republic of Kazakhstan and the provisions of the PMK;
• Provide income certificates at the request of employees;
• Monitor and study any changes in the labor, pension and tax legislation of the Republic of Kazakhstan relevant to payroll;
• Preparation and provision of statistical reports in accordance with the established deadlines;
• Take an active part in new projects related to the activities of the finance department.

Who we’re looking for:
• Higher financial/economic education;
• Knowledge of the basics of accounting and finance;
• English language proficiency at least at Upper Intermediate level;
• Experience in finance/accounting will be preferred;
• Skills of working in MS Office (Excel, Word) at the level of an experienced user.

What we offer:
- An opportunity to pursue your ambitions and develop your skills with a global business – our staggering size and scale provides endless opportunities to progress;
- An opportunity to build an international career and for cross-functional moves;
- Extended social package: life insurance, insurance from critical illnesses, additional payment for preschool development of children, participation in the Employee Assistance Program (financial, psychological and legal consultations) for employees and family members, and much more.

*Relocation support is not available for this job",1–3 года,Полная занятость,График: 5/2,Рабочие часы: 8,Не указано,28 апреля 2025,https://hh.kz/vacancy/120021212?query=Data+Specialist&hhtmFrom=vacancy_search_list,"MS Office,Excel,SAP,Interpersonal skills,Английский — C1 — Продвинутый"
Risk and Internal Controls Specialist in Audit Department (Astana),ТОО KPMG,Не указано,Не указано,"KPMG is searching for Risk and Internal Controls Specialist in Audit Department

As a Risk and Internal Controls Specialist, you will:

Create and set up controls in the QTracker system.

Monitor the timely submission of controls according to the approved plan.

Fill in controls in the system as needed.

Communicate internally, primarily with employees of the Audit department.

Assist with analyzing risks, preparing reports, and ensuring compliance with internal control standards.

Support risk management efforts and help with internal audits.

Contribute to the development and improvement of internal audit processes.

You’re the perfect match for this role if you:

Have at least 1 year of experience in risk management, internal audit, or related areas, preferably within a consulting or audit firm.

Have a good understanding of internal controls and risk management practices.

Are proficient in spoken and written English (B2 or higher).

Possess strong communication, analytical, and problem-solving skills.

Are able to work effectively in a team environment and maintain attention to detail in all tasks.

Diversity & Inclusion Statement

We are committed to creating a diverse and inclusive workplace. All qualified applicants will receive consideration for employment regardless of their unique abilities, background, or identity.",1–3 года,Полная занятость,График: 5/2,Рабочие часы: 8,Не указано,28 апреля 2025,https://hh.kz/vacancy/120008840?query=Analytics+Consultant&hhtmFrom=vacancy_search_list,Не указано
