title,company,location,salary,description,experience,employment_type,schedule,working_hours,work_format,link,published_date,skills
Data Scientist / Разработчик AI-бота,"Центр развития города Алматы, АО","Алматы, проспект Абая, 90",Не указано,"Описание вакансии

Центр Data-аналитики города Алматы приглашает Data Scientist’а для участия в разработке интеллектуального чат-бота на основе LLM, предназначенного для анализа и визуализации городских данных.

Бот будет служить интеллектуальным интерфейсом к данным Ситуационного центра Алматы, предоставляя пользователям текстовые ответы, графики, карты и отчёты.

Обязанности:

Разработка логики обработки естественного языка с использованием LLM (GPT-4, LLaMA и др.)

Преобразование пользовательских запросов в корректные SQL-запросы к базе PostgreSQL

Валидация и отладка SQL-запросов

Построение визуальных ответов:

графики (Plotly, Matplotlib)

карты (Folium, Leaflet и пр.)

генерация отчётов (PDF, Excel)

Работа с существующей базой данных (данные поддерживаются отдельной командой инженеров)

Настройка взаимодействия между LLM, базой данных и визуальным выводом

Требования:

Опыт работы в роли Data Scientist / ML-инженера от 3 лет

Отличное знание Python

Уверенное владение SQL (желательно PostgreSQL)

Опыт работы с LLM (OpenAI API, LLaMA, LangChain или аналогичные инструменты)

Умение визуализировать данные (Plotly, Matplotlib, Folium и др.)

Навыки обработки естественного языка


Желательно:

Опыт создания диалоговых AI-систем

Знание принципов построения архитектуры чат-ботов

Понимание концепции Retrieval-Augmented Generation (RAG)

Навыки генерации отчётов в PDF/Excel


Мы предлагаем:

Участие в значимом городском проекте с реальными данными

Полную поддержку со стороны аналитиков и инженеров данных

Чётко очерченную зону ответственности: от запроса до ответа

Гибкий график работы после завершения испытательного срока

Вознаграждение обсуждается индивидуально


Как откликнуться:

Пожалуйста, прикрепите к отклику:

Ваше актуальное резюме

Ссылки на реализованные проекты, GitHub или статьи (если есть)

Короткий комментарий, как бы вы реализовали чат-бот с LLM, SQL и визуализациями",3–6 лет,"Полная занятость
Возможно временное оформление",График: 5/2,Рабочие часы: 8,Формат работы: на месте работодателя или гибрид,https://almaty.hh.kz/vacancy/119483821?query=ML+Engineer&hhtmFrom=vacancy_search_list,14 апреля 2025,"Python,SQL,PostgreSQL,LLM,AI,Чат-бот,Визуализация данных,Deep Learning,Алгоритмы и структуры данных,Big Data,Разработка ПО"
Python Backend Developer,ООО Сумма АйТи,Не указано,"от 1 700 до 2 500 $ за месяц, на руки","Hello there!

Our development department has a project for which they're seeking an experienced Python developer to join our team working on our analytics AI agent system. You'll be responsible for enhancing our analytics tools, improving our AI prompts, and developing new data processing capabilities.

Technology Stack

Python backend services
OpenAI GPT models
LangChain framework for AI orchestration
Pydantic for data validation and modeling
RESTful API architecture

What You'll Do

Maintain and extend our analytics tools that process campaign, source, ad, and user data
Optimize API calls and improve data processing efficiency
Refine AI prompt engineering to better understand user queries
Implement data visualization capabilities for analytics reports
Ensure secure data handling and proper parameter validation
Develop new analytics features based on business requirements

Key Challenges

Translating natural language requests into precise analytics queries
Optimizing API calls to minimize resource usage while maximizing data insights
Handling complex date ranges and comparison operations
Ensuring accurate metric calculations and proper data formatting
Maintaining clear and helpful error messaging for users

Required Skills

Strong Python development experience (3+ years)
Experience with AI/ML frameworks, particularly LLMs
Familiarity with analytics concepts (marketing channels, user behavior, etc.)
RESTful API development background
Knowledge of data validation and processing techniques
Ability to work with complex data structures and transformations

Preferred Qualifications

Experience with LangChain or similar LLM framework
Background in marketing analytics or web analytics
Knowledge of prompt engineering for LLMs
Experience with data visualization libraries
Understanding of e-commerce metrics and KPIs

The reason this job vacancy is written in English is that we are looking for a candidate who has proficiency in the language at the B1-B2 level.
﻿
﻿﻿If you are interested in participating in our project, please apply for the vacancy! We look forward to meeting you!﻿",1–3 года,Полная занятость,График: 5/2,Рабочие часы: 8,Формат работы: удалённо,https://almaty.hh.kz/vacancy/118740671?query=ML+Engineer&hhtmFrom=vacancy_search_list,18 апреля 2025,"Python,REST API,Pydantic,LangChain"
Python ML/AI Engineer,Itransition,Не указано,Не указано,"Join our team to work on an innovative AI Assistant application that empowers users across a wide range of roles—sales reps, managers, data scientists, and executives—to interact with structured, semi-structured, and unstructured data using natural language. The Assistant provides insights, executes actions, and supports complex decision-making workflows with minimal user interaction.

Responsibilities:

Develop and integrate LLM-based features using LangChain and OpenAI
Build and optimize RAG pipelines and vector search systems
Collaborate with the team to improve prompt engineering and system performance

Requirements:

Strong experience with Python
Hands-on experience with LangChain and LangGraph
Proficiency in integrating OpenAI API
Solid background in prompt engineering and RAG systems
Experience with embeddings and vector databases

Nice to Have:

Experience with AWS Bedrock
Familiarity with complex agent workflows

We can offer:

Projects for such clients as PayPal, Wargaming, Xerox, Philips, adidas and Toyota
Competitive compensation that depends on your qualification and skills
Career development system with clear skill qualifications
Flexible working hours aligned to your schedule
Options to work remotely
Compensation of medical costs
English courses online
Corporate parties and events for employees and their children
Gym membership compensation, corporate sport competitions (cybersport included)
5 days of paid sick leave per year with no obligation to submit a sick-leave certificate",1–3 года,Полная занятость,График: 5/2,Рабочие часы: 8,"Формат работы: на месте работодателя, удалённо или гибрид",https://almaty.hh.kz/vacancy/119560794?query=ML+Engineer&hhtmFrom=vacancy_search_list,15 апреля 2025,"Python,Английский язык,OpenAI,LangChain,Английский — B2 — Средне-продвинутый"
ML Engineer,ТОО КазСканСервис,Не указано,Не указано,"Обязанности:

Разработка и внедрение ML-моделей для платформы цифровых двойников (предиктивная аналитика, мониторинг оборудования, оптимизация производственных процессов)

Работа с временными рядами, данными датчиков (IoT, SCADA), облаками точек и пространственными данными (LiDAR)

Анализ больших объемов данных для выявления паттернов и аномалий

Интеграция моделей с существующей инфраструктурой платформы

Оценка качества моделей и оптимизация их производительности

Участие в разработке и поддержке архитектуры данных

Парсинг и структурирование данных из открытых и закрытых источников (сайты, API, документация оборудования)

Требования:

Опыт работы от 2 лет в области Data Science / Machine Learning

Глубокое понимание алгоритмов машинного обучения и анализа данных

Опыт работы с временными рядами, предиктивной аналитикой и обнаружением аномалий.

Практический опыт разработки моделей с использованием Python и основных библиотек (pandas, numpy, sklearn, tensorflow/pytorch, XGBoost)

Опыт работы с инструментами для визуализации данных (Plotly, matplotlib, Power BI)

Знание SQL и баз данных (PostgreSQL, MongoDB)

Опыт работы с большими объемами данных и облачными платформами (AWS, Azure) будет преимуществом

Понимание процессов CI/CD, опыт работы с Git

Дополнительные навыки (не обязательно):

Опыт работы с пространственными данными и облаками точек (Potree, Three.js, PDAL)

Опыт интеграции с системами SCADA, MES, ERP

Опыт работы с графовыми базами данных (Neo4j)

Опыт работы в промышленности, строительстве или инфраструктурных проектах

Умение работать с ИИ сервисами (ChatGPT, Claude, Gemini, Perplexity)

Условия:

Работа на передовой технологий: цифровые двойники, AI, 3D-визуализация и крутые промышленные кейсы
Полная свобода действий: твои идеи не будут пылиться в столе, а сразу пойдут в прод!
Офис в инновационном хабе Astana Hub",1–3 года,Полная занятость,График: 5/2,Рабочие часы: 8,Формат работы: на месте работодателя или гибрид,https://almaty.hh.kz/vacancy/119473837?query=ML+Engineer&hhtmFrom=vacancy_search_list,14 апреля 2025,"Python,SQL,REST API,Git,Docker,SCADA,API,Deep Learning,TensorFlow,pandas,Английский язык,Английский — B2 — Средне-продвинутый"
Python-разработчик,Публичная Компания «Freedom Finance Global PLC»,Не указано,Не указано,"Задачи:

Разработка и поддержка веб-приложений на Python с использованием FastAPI;
Проектирование и разработка RESTful;
Интеграция с базами данных (PostgreSQL, Greenplum);
Разработка backend-части для сервиса поиска и рекомендаций;
Оптимизация производительности и масштабируемости сервисов;
Взаимодействие с ML-инженерами и интеграция моделей LLM в backend;
Настройка тестирования и CI/CD процессов;
Документирование API и написание технической документации.

Мы ожидаем от кандидата:

Уверенное владение Python (3.8+), знание FastAPI;
Опыт работы с SQL и ORM (SQLAlchemy, Tortoise-ORM);
Понимание архитектуры веб-приложений (MVC, Microservices, Event-Driven);
Опыт работы с Docker, Kubernetes, CI/CD;
Владение инструментами мониторинга (Prometheus, Grafana);
Умение писать тесты (pytest, unittest).

Будет плюсом:

Опыт работы с брокерами сообщений (RabbitMQ, Kafka, Redis);
Опыт работы с LLM API (OpenAI, Hugging Face, LangChain).

Что мы предлагаем:

Профессиональный коллектив;
Возможность работать над проектами, приносящими пользу для тысяч людей;
Неограниченный рост;
Комфортный офис в центре города;
Скидки на фитнесс, обучение английскому языку, подарки на праздники и дни рождения;
Бонусы и уникальные предложения от компаний холдинга;
Спонсирование профессионального обучения;
Насыщенная корпоративная жизнь с выездами на природу, праздничными мероприятиями в офисе, играми и розыгрышами подарков.",1–3 года,Полная занятость,График: 5/2,Рабочие часы: 8,Формат работы: на месте работодателя,https://almaty.hh.kz/vacancy/118340190?query=ML+Engineer&hhtmFrom=vacancy_search_list,11 апреля 2025,"Python,SQL,Docker,CI/CD,PostgreSQL,Greenplum"
Frontend-разработчик,ТОО КазСканСервис,Не указано,Не указано,"KazScanService развивает QazTWIN — платформу цифровых двойников для промышленности, строительства и смарт-городов. Работаем с лазерными сканами, облаками точек, предиктивной аналитикой и SCADA-системами. Ты будешь частью команды, создающей интерфейсы для реального оборудования.

Обязанности:

Разработка интерфейсов для платформы цифровых двойников (React + TypeScript)

Визуализация 3D-объектов, облаков точек, карт и телеметрии

Интеграция с backend API (REST / WebSocket)

Создание адаптивных и удобных панелей для мониторинга, тикетов, инвентаризации

Внедрение новых UI-компонентов: фильтры, тултипы, режимы отображения, 3D-навигация

Работа с дизайн-системой, компонентами и UI/UX-документацией

Обязательные:

Уверенные знания JavaScript и TypeScript

Опыт работы с React (от 1–2 лет)

Знание HTML5, CSS3, адаптивной вёрстки

Опыт работы с REST API, базовая работа с WebSocket

Опыт использования систем контроля версий (Git)

Понимание архитектуры SPA, состояния (Redux/Zustand/Context)

Желательно:

Опыт или желание работать с WebGL / Three.js / Potree

Базовое понимание работы с 3D-сценами: камеры, освещение, материалы

Навыки работы с карта + 3D (например, CesiumJS, MapboxGL, Leaflet)

Опыт работы с CI/CD, Docker (для локальной сборки и деплоя)

Будет плюсом:

Опыт в проектах из индустрии (Smart City, BIM, IoT, SCADA)

Понимание принципов UX в инженерных системах

Опыт с Tailwind, Material UI, Ant Design

Что мы предлагаем:

Участие в амбициозном проекте цифровых двойников на базе Astana Hub

Возможность роста в направлении 3D и geospatial-визуализации

Работа в команде с ML-инженерами, разработчиками, инженерами LIDAR/SCADA

Гибкий график, минимум бюрократии, максимум технологий

Все нужные ресурсы для прокачки по WebGL / Three.js — если ты пока не работал с этим, научим и поддержим",1–3 года,Полная занятость,График: 5/2,Рабочие часы: 8,Формат работы: на месте работодателя,https://almaty.hh.kz/vacancy/119597087?query=ML+Engineer&hhtmFrom=vacancy_search_list,16 апреля 2025,"JavaScript,TypeScript,React,Redux,API,HTML5,TailwindCSS,REST API,WebGL,Potree,Git,Trello,Docker,Figma,CesiumJS,Three.js,WebSocket,Английский — B2 — Средне-продвинутый"
Middle ML Engineer (NLP),ТОО Documentolog,"Нур-Султан (Астана), проспект Мангилик Ел, 52А",Не указано,"Наша компания ищет специалиста в области NLP для работы на долгосрочной основе.

Обязанности:
- Создание сервисов на базе генеративных AI и классических ML/DL моделей;
- Сбор, обработка и загрузка данных из различных источников (SQL, NoSQL), работа с Дата пайплайнами;
- Разработка и поддержка API микросервисов, в т.ч. для деплоя моделей;
- Следовать современным трендам в области AI/DS;
- Сотрудничать с продуктовыми командами для успешного, своевременного внедрения и обслуживания сервисов;
- Проводить исследования и эксперименты с различными наборами данных;
- Управлять сложными рабочими процессами с данными и развивать экспертизу в предметной области.

Требования:
- Опыт работы не менее 2-х лет, из них:
в сфере Data Science / ML Engineering / Data Engineering не менее 2-х лет;
в сфере Deep Leanring и AI не менее 1 года;
- Практический опыт работы в NLP: обучение, оценка и использование моделей;
- Опыт работы с LLM: prompt engineering, evaluation, fine-tuning и т.д.;
- Опыт построения ETL процессов и интеграции данных из различных источников (БД, API, файловые системы);
- Опыт подготовки, аннотирования и предобработки данных для NLP задач;
- Понимание принципов работы классических ML/DL алгоритмов и моделей;
- Знание Python: умение писать чистый, тестируемый код;
- Знание SQL, Git, Docker, CI/CD.
- Плюс: опыт работы в построении Дата пайплайнов с помощью оркестраторов (Airflow, Dagster и т.д.) и/или распределённых систем (Spark, Hadoop и т.д.)

Условия:

- Оформление по ТК РК;
- Режим работы 5/2, с 09:00 до 18:30, обед с 13:00 до 14:30;
- Дружный коллектив и удобный офис.

Система мотивации:
- Беспроцентные займы: Финансовая поддержка сотрудников, проработавших в компании более 1 года;
- Фантомные акции компании: Сотрудники с опытом работы более 1 года получают возможность получать процент от чистой прибыли компании. Количество фантомных акций увеличивается с каждым годом работы в знак признательности за преданность и лояльность сотрудника.",1–3 года,Полная занятость,График: 5/2,Рабочие часы: 8,Не указано,https://almaty.hh.kz/vacancy/117789224?query=ML+Engineer&hhtmFrom=vacancy_search_list,19 апреля 2025,"Data Science,Machine Learning,Python,SQL,NLP,Английский — B1 — Средний"
