title,company,location,salary,description,experience,employment_type,schedule,working_hours,work_format,published_date,link,skills
SAP BPC/BW consultant,ТОО IBA Astana Dev (АйБиЭй Астана Дев),Не указано,Не указано,"Мы в поисках опытного SAP BPC консультанта для действующего проекта в АО ""НАК Казатомпром"". Полная загрузка 100%, без командировок. Рабочий язык - русский.

Обязанности:

Поддержка существующего решения на SAP BPC (SAP BPC 10.1/11 Embedded/Standard)

Решение инцидентов и проблем пользователей (L3 поддержка)

Анализ и исправление ошибок в отчетности и процессах консолидации

Разработка новых отчетов в SAP BPC и SAP BW (при необходимости)

Работа с запросами изменений (Change Requests)

Взаимодействие с ключевыми пользователями и командой поддержки

Документирование изменений и исправлений

Требования:

4+ лет опыта в поддержке или внедрении решений SAP BPC (Embedded или Standard)

Уверенные навыки работы с SAP BW (создание/поддержка инфообъектов, DSO, кубов, трансформаций)

Навыки проведения анализа инцидентов, локализации и исправления ошибок

Понимание интеграции SAP BPC с другими модулями SAP (FI, CO)

Способность писать техническую документацию на русском языке

Плюсом будет:

Опыт работы в проектах крупных промышленных холдингов

Опыт настройки Business Process Flows (BPF) в SAP BPC

Базовое знание SAP Analytics Cloud (SAC)

Условия:
самостоятельная работа в проектной среде (без обучения с нуля)
обсуждаемый формат работы (удаленно или офис)",3–6 лет,"Проект или разовое задание
Возможно временное оформление",График: 5/2,Рабочие часы: 8,Формат работы: удалённо,28 апреля 2025,https://hh.kz/vacancy/120034992?query=Analytics+Consultant&hhtmFrom=vacancy_search_list,SAP BW
Computer Vision Engineer,ТОО Smart Parking Technologies,Не указано,Не указано,"Parqour - казахстанский быстроразвивающийся IT стартап, занимаемся автоматизацией парковочных систем в Казахстане и в странах дальнего зарубежья, быстро масштабируемся на глобальный рынок. Есть офисы и представительства в США, ОАЭ, Азербайджан, Узбекистан, Кыргызстан. Начинали путь с нескольких ребят, сейчас более 100 сотрудников и мы только растем.

Наша цель - безопасность и оперативность технологических решений. Сокращаем время обработки, даем экологичное решение и удобство для наших клиентов.

У нас своя команда разработки, внедрения и сопровождения. Мы всегда в поиске талантливых профессионалов.

Требования:

- Опыт разработки в области компьютерного зрения и машинного обучения 3+ лет;
- Отличное знание языков программирования C++/C и Python;
- Глубокий опыт работы с библиотеками и фреймворками компьютерного зрения: OpenCV, GStreamer (на уровне оптимизации пайплайнов и глубокого понимания архитектуры);
- Хорошее владение одним или несколькими ML/DL фреймворками: PyTorch, TensorFlow (включая разработку и адаптацию кастомных моделей);
- Умение проектировать и внедрять алгоритмы компьютерного зрения и архитектуры нейронных сетей под задачи бизнеса;
- Уверенный опыт оптимизации и деплоймента моделей с использованием ONNX, TensorRT, NCNN;
- Опыт разработки в средах Linux, работы с SQL, управления проектами через git и контейнеризацию через Docker;
- Глубокое понимание производственных требований к системам ML (robustness, latency, scalability, maintainability).

Будет преимуществом:
- Опыт подготовки моделей для продакшн: quantization, pruning, knowledge distillation, clustering;
- Опыт оптимизации вычислений на GPU, работа с CUDA, cuDNN.

Обязанности:
- Проектирование, обучение и подготовка CV/ML моделей для различных задач (детекция, классификация, сегментация и пр.) с фокусом на продакшн;
- Разработка, оптимизация и внедрение алгоритмов обработки изображений и видеопотоков;
- Построение полноценных пайплайнов от обработки данных до деплоймента моделей;
- Разработка и поддержка API/SDK для работы с обученными моделями, интеграция их в конечные продукты;
- Оптимизация производительности моделей для встраиваемых и серверных решений (Jetson, ARM, x86).

Условия:

Молодой и дружный коллектив, который всегда в развитии и Self-driven;
Обучение за счёт компании. Для профессионального развития, при необходимости за счет компании пройти курсы повышения квалификации или участвовать на конференцию, связанную с вашей работой.",3–6 лет,Полная занятость,График: 5/2,Рабочие часы: 8,Формат работы: на месте работодателя,28 апреля 2025,https://hh.kz/vacancy/120037751?query=ML+Engineer&hhtmFrom=vacancy_search_list,"ML,ONNX,C++,Английский — C1 — Продвинутый,Казахский — C1 — Продвинутый,Русский — C2 — В совершенстве"
Senior SAP Reporting Consultant (BI/BO/BW/SAC/Datasphere),ТОО iQ-SOLUTIONS,Не указано,Не указано,"Key Responsibilities:

System Support & Maintenance:
Provide ongoing support for the existing SAP BI and BO environments, including incident resolution, user assistance, and performance tuning of reports and dashboards.
SAC Development & Management:
Maintain and further develop reports and dashboards in SAP Analytics Cloud (SAC).
Qualtrics Integration & Insights:
Support the use of SAP Qualtrics for customer and employee experience analytics. Help business teams extract, interpret, and apply insights from Qualtrics data effectively.
Collaboration with Stakeholders:
Work closely with business users and functional teams to understand reporting requirements, propose solutions, and support self-service reporting initiatives.
Data Integration:
Support and improve existing data integration flows between SAP and non-SAP systems used in reporting.
Issue Resolution & Troubleshooting:
Identify and resolve issues related to data accuracy, report logic, and system performance.
Training & Enablement:
Conduct training sessions and provide guidance to business users and junior team members on using BI/BO tools effectively.

Required Qualifications:

Experience:
7+ years of experience in SAP BI/BO environments
Technical Expertise:
Advanced skills in SAP BusinessObjects (Web Intelligence, Crystal Reports, BO Dashboards).
Strong experience with SAP Analytics Cloud (reporting, dashboard design, data modeling).
Solid background in SAP BW, SAP HANA, and BEx Queries.
Proficiency in SQL and data analysis across SAP and non-SAP sources.
Qualtrics Experience:
Hands-on experience working with SAP Qualtrics, understanding its data model and integration with BI tools is a plus.
Analytical & Problem-Solving Skills:
Ability to translate business questions into technical solutions and meaningful dashboards or reports.
Communication Skills:
Strong verbal and written communication skills. Able to explain complex reporting concepts to non-technical stakeholders.
Education:
Bachelor's or Master's degree in Computer Science, Information Systems, Business Analytics, or a related field. SAP certifications are a strong advantage.

Preferred Qualifications:

SAP certifications in BI, BO, SAC, or BW/4HANA.
Knowledge of SAP Datasphere, Embedded Analytics

Personal Attributes:

Detail-oriented with a passion for data quality and visualization.
Proactive and self-motivated with a continuous improvement mindset.
Strong interpersonal skills and a collaborative working style.",3–6 лет,Полная занятость,График: 5/2,Рабочие часы: 8,Формат работы: удалённо,28 апреля 2025,https://hh.kz/vacancy/120033105?query=Data+Science+Manager&hhtmFrom=vacancy_search_list,"SAP Analytics Cloud,SAP Qualtrics,SAP BusinessObjects"
Бизнес-аналитик (управление данными),ТОО АСУ Кибернетика,Не указано,Не указано,"Обязанности:

​​​​​​- Участие в проектах по внедрению Master Data Management (MDM) и Data Governance (DG) систем.
- Проведение предпроектного обследования: сбор, анализ и структурирование требований заказчика.
- Анализ существующих процессов управления данными и разработка предложений по их оптимизации.
- Подготовка функциональных и технических требований (ТЗ) для реализации решений в области MDM/DG.
- Построение моделей данных и описание бизнес-процессов.
- Взаимодействие с бизнес-подразделениями и техническими командами (архитекторы, разработчики).
- Поддержка команды разработки на этапе реализации и сопровождения решений.
- Участие в тестировании решений на соответствие требованиям.

Требования:

​​​​​​- Опыт работы на проектах внедрения MDM и/или Data Governance — обязателен.
- Практический опыт проведения предпроектных обследований: интервьюирование, анализ текущих процессов, выявление требований.
- Опыт написания технических заданий и другой проектной документации.
- Понимание архитектуры MDM-систем и принципов интеграции с корпоративными системами.
- Знание основных концепций управления данными.

Мы предлагаем:

- Хорошая зарплата

- Выплата премии

-​​​​​​​ Работа над интересными проектами

-Обучение и развитие

- Комфортные условия труда

- Работа в команде единомышленников",1–3 года,Полная занятость,График: 5/2,Рабочие часы: 8,Формат работы: на месте работодателя,28 апреля 2025,https://hh.kz/vacancy/120037991?query=Data+Architect&hhtmFrom=vacancy_search_list,Не указано
"Специалист по информационной безопасности (Fintech, English) / Informational Security Officer",ЧАСТНАЯ КОМПАНИЯ COLLECT&PAY LTD.,"Астана, проспект Мангилик Ел, 55/17",Не указано,"Collect Group Holdings is a progressive group of fintech companies founded in 2017. Our mission is to revolutionize the way businesses manage customer relationships. We strive for innovation and excellence, specializing in the development of cutting-edge fintech and blockchain platforms.

Our companies:

Collect & Pay

Collect & Exchange

Capital Pay

Vacancy: Information Security Specialist
Location: Republic of Kazakhstan, Astana
Work format: Office

The Information Security Officer (ISO) is responsible for establishing and maintaining the company’s information security program, ensuring that information assets and associated technologies, applications, systems, infrastructure, and processes are protected in accordance with regulatory, legal, and business requirements of the Republic of Kazakhstan and international standards. This role will play a crucial part in compliance with AIFC regulations, enhancing organizational cybersecurity readiness and resilience.

Key Responsibilities

Ensure compliance with Kazakhstani laws, including: Law on Informatization, Law on Personal Data and Their Protection, Law on Payments and Payment Systems, Rules for Organizing the Activities of Payment Organizations (NBK Resolution).


Lead internal information security awareness training and phishing simulation campaigns.


Coordinate and execute response protocols for malware infections, unauthorized access attempts, and suspicious financial transactions.


Manage vulnerability identification and remediation; establish preventive security controls.


Maintain comprehensive logs and records of security incidents and events; generate internal and regulatory reports as required.


Assist in external and internal audits, ensuring continued compliance with standards such as ISO/IEC 27001 and PCI DSS.


Support IT infrastructure teams to ensure secure and resilient technology operations aligned with legal and business expectations.


Perform security risk assessments and contribute to ongoing risk management planning.

Qualifications

Bachelor's degree in Information Security, Computer Science, Cybersecurity, or related field.


Minimum 3–5 years of experience in an information security role, preferably within fintech, banking, or payment institutions.


Strong knowledge of Kazakhstani information security laws and regulations.


Experience working with or within regulatory bodies (e.g., AIFC) is an asset.


Industry certifications preferred (e.g., CISSP, CISM, ISO 27001 Lead Implementer, CEH).


Knowledge of international standards (ISO/IEC 27001, PCI DSS) and risk frameworks (e.g., NIST, COBIT).


Fluency in Kazakh and/or Russian; English proficiency desirable for regulatory communication.

What do we offer?

You will have the status of an employee at a tech company with great growth potential, a very long runway, and large, growing markets

Competitive salary and stable working conditions

Career and professional development opportunities

Paid lunches

Engaging tasks that will help you grow

A friendly team with no unnecessary formalities and hierarchy

Opportunity for additional company-sponsored training",3–6 лет,Полная занятость,График: 5/2,Рабочие часы: 8 или 9,Формат работы: на месте работодателя,28 апреля 2025,https://hh.kz/vacancy/120025049?query=Data+Specialist&hhtmFrom=vacancy_search_list,"Информационная безопасность,Английский язык,Аудит,Аудит информационной безопасности,Английский — B2 — Средне-продвинутый"
"Специалист по информационной безопасности (Fintech, English) / Informational Security Officer",ЧАСТНАЯ КОМПАНИЯ COLLECT&PAY LTD.,"Астана, проспект Мангилик Ел, 55/17",Не указано,"Collect Group Holdings is a progressive group of fintech companies founded in 2017. Our mission is to revolutionize the way businesses manage customer relationships. We strive for innovation and excellence, specializing in the development of cutting-edge fintech and blockchain platforms.

Our companies:

Collect & Pay

Collect & Exchange

Capital Pay

Vacancy: Information Security Specialist
Location: Republic of Kazakhstan, Astana
Work format: Office

The Information Security Officer (ISO) is responsible for establishing and maintaining the company’s information security program, ensuring that information assets and associated technologies, applications, systems, infrastructure, and processes are protected in accordance with regulatory, legal, and business requirements of the Republic of Kazakhstan and international standards. This role will play a crucial part in compliance with AIFC regulations, enhancing organizational cybersecurity readiness and resilience.

Key Responsibilities

Ensure compliance with Kazakhstani laws, including: Law on Informatization, Law on Personal Data and Their Protection, Law on Payments and Payment Systems, Rules for Organizing the Activities of Payment Organizations (NBK Resolution).


Lead internal information security awareness training and phishing simulation campaigns.


Coordinate and execute response protocols for malware infections, unauthorized access attempts, and suspicious financial transactions.


Manage vulnerability identification and remediation; establish preventive security controls.


Maintain comprehensive logs and records of security incidents and events; generate internal and regulatory reports as required.


Assist in external and internal audits, ensuring continued compliance with standards such as ISO/IEC 27001 and PCI DSS.


Support IT infrastructure teams to ensure secure and resilient technology operations aligned with legal and business expectations.


Perform security risk assessments and contribute to ongoing risk management planning.

Qualifications

Bachelor's degree in Information Security, Computer Science, Cybersecurity, or related field.


Minimum 3–5 years of experience in an information security role, preferably within fintech, banking, or payment institutions.


Strong knowledge of Kazakhstani information security laws and regulations.


Experience working with or within regulatory bodies (e.g., AIFC) is an asset.


Industry certifications preferred (e.g., CISSP, CISM, ISO 27001 Lead Implementer, CEH).


Knowledge of international standards (ISO/IEC 27001, PCI DSS) and risk frameworks (e.g., NIST, COBIT).


Fluency in Kazakh and/or Russian; English proficiency desirable for regulatory communication.

What do we offer?

You will have the status of an employee at a tech company with great growth potential, a very long runway, and large, growing markets

Competitive salary and stable working conditions

Career and professional development opportunities

Paid lunches

Engaging tasks that will help you grow

A friendly team with no unnecessary formalities and hierarchy

Opportunity for additional company-sponsored training",3–6 лет,Полная занятость,График: 5/2,Рабочие часы: 8 или 9,Формат работы: на месте работодателя,28 апреля 2025,https://hh.kz/vacancy/120025049?query=Data+Science+Manager&hhtmFrom=vacancy_search_list,"Информационная безопасность,Английский язык,Аудит,Аудит информационной безопасности,Английский — B2 — Средне-продвинутый"
Exploration Geologist,Частная компания IG Copper and Gold,Не указано,"от 1 000 000 до 1 500 000 ₸ за месяц, на руки","JOB DUTIES/RESPONSIBILITIES:

Manages geological (geophysical, hydrogeological) activities of the geological Company;
Management of all types of exploration and production works;
Compliance with safety rules during Exploration;
Conducting regular site inspections and preparing risk/safety assessments;
Work proficiently in a team environment with minimal supervision;
Reviewing, examining, compiling, and digitizing historical data
GIS support;
Field man with experience on solid minerals in the fields:
Geological mapping

Sampling (chip, grab, channel, core, cutting samples);

Geological and geotechnical logging;
Coordinating and supervising drilling operations;
Mentoring of junior staff to enhance their technical skills and capabilities;
Targeting of exploration work;
Exploration plan design and budgeting;
Coordination and supervision of field, laboratory, geological, and geophysical operations;
Collection, analysis and interpretation of infrared spectroscopy data

quality control;

Logistics and maintenance of vehicles;
Willingness to perform other duties as necessary to ensure the success of the IGCG;
Daily, weekly, monthly, and annual reporting

REQUIRED EDUCATION, WORK EXPERIENCE & TRAINING:

Bachelor’s degree, Master’s degree in Geology or Geological Engineering.
Work experience > 3 years

TECHNICAL SKILLS:

Familiarity with Microsoft Office programs, QGIS, LeapFrog, Clino Field Move, ArcGIS;
Can work safely;
Can work responsibly and independently;
Strong work ethic;
Positive attitude and aptitude to accept a challenging and dynamic work environment;
Excellent written and communication skills;
Team oriented.
English language: B2
Kazakh language: B1

Full-Time 5/2
Frequent field trips",3–6 лет,Полная занятость,График: 6/1 и другие варианты,Рабочие часы: 8,Не указано,28 апреля 2025,https://hh.kz/vacancy/120018893?query=Data+Miner&hhtmFrom=vacancy_search_list,Не указано
